{
    "schema_version": "gitnexus-worktree-health-observation/v1",
    "repository_name": "example-repo",
    "current_checkout": {"path": "C:/repo/linked", "head_sha": "2222222222222222222222222222222222222222", "origin_main_sha": "1111111111111111111111111111111111111111", "branch": null, "dirty": false},
    "worktrees": [
      {"path": "C:/repo", "head_sha": "1111111111111111111111111111111111111111", "branch": "refs/heads/main", "dirty": null, "locked": false, "prunable": false, "owner": "coordinator", "owner_status": "idle", "last_activity": "2026-07-27T00:00:00.000Z"},
      {"path": "C:/repo/linked", "head_sha": "2222222222222222222222222222222222222222", "branch": null, "dirty": false, "locked": false, "prunable": false, "owner": "explorer", "owner_status": "active", "last_activity": "2026-07-28T00:00:00.000Z"}
    ],
    "gitnexus": {"status": "healthy", "indexed_path": "C:/repo/linked", "indexed_commit": "2222222222222222222222222222222222222222", "fts_status": "healthy", "registrations": [{"name": "example-repo", "path": "C:/repo/linked"}]}
}
